{
  "adapter_version": "brief_strategy_diff_adapter_v1",
  "cache_hit": false,
  "inputs": {
    "left": {
      "inputs_hash": "d726b4535ab463f9ddf8ffce3f5acc0046bf1796e5eac9f7650aa47109a36f5c",
      "markdown_hash": null,
      "normalized_strategy_hash": "4610641d0fe02046c36babd722f08bd058d50415a7bf0cb28c74567ec6054b64"
    },
    "right": {
      "inputs_hash": "d726b4535ab463f9ddf8ffce3f5acc0046bf1796e5eac9f7650aa47109a36f5c",
      "markdown_hash": null,
      "normalized_strategy_hash": "4610641d0fe02046c36babd722f08bd058d50415a7bf0cb28c74567ec6054b64"
    }
  },
  "inputs_hash": "5001039fe9322b9eb34c86c693ed75ce43151d6ecb77c9c730297900785530c0",
  "normalized_diff_hash": "f49cd1b0eb04fb4a89b27fffa56339782726d60f1498e27eaf1b21d94bf31b0b",
  "rows": {
    "nonzero_deltas_count": 0
  },
  "schema_version": 1
}